{
  "$schema": "../../scripts/guardrails/schema.json",
  "version": 2,
  "srcRoot": "src",
  "src": {
    "nested": {
      "execution": [
        "actions",
        "artifacts",
        "context",
        "handlers",
        "job_runner",
        "oidc",
        "shadow",
        "steps_runner"
      ],
      "execution/artifacts": [
        "service"
      ],
      "*": [
        "tests"
      ]
    },
    "requireReadme": [
      "docker",
      "execution",
      "execution/actions",
      "execution/artifacts",
      "execution/artifacts/service",
      "execution/context",
      "execution/handlers",
      "execution/job_runner",
      "execution/oidc",
      "execution/shadow",
      "execution/steps_runner",
      "execution/tests",
      "node"
    ]
  },
  "fileSize": {
    "max": 500,
    "skipExtensions": []
  },
  "functionSize": {
    "max": 150
  },
  "testDir": "tests",
  "testGlob": "",
  "barrelNames": [
    "mod.rs"
  ],
  "barrelExempt": [],
  "bannedDeps": [],
  "filenameCase": [
    {
      "glob": "*.rs",
      "regex": "^[a-z0-9_]+[.]rs$",
      "describe": "snake_case"
    }
  ],
  "secrets": {
    "neverTracked": [
      ".env"
    ],
    "scanExempt": [
      "tests/job_outputs_message.json"
    ]
  },
  "shadowConfigs": [
    {
      "found": "lefthook.yaml",
      "use": "lefthook.yml",
      "why": "the lefthook 2.x installer shadows a .yaml, so the hooks never run"
    }
  ],
  "ownedByLinter": []
}
